,course_id,section_name,meeting_id,building_abb,room,monday,tuesday,wednesday,thursday,friday,saturday,sunday,frequency,section_status,days,section_title,min_credits,faculty_name,meeting_info,course_description,building_names,faculty_first,faculty_last,division,department_abbreviation,department_name,course_num,seven_week,term,start_date,end_date,start_time,end_time,gen_ed_abb,gen_ed_names,same_as,max_credits,also_fulfills,section_comments,pre_reqs,co_reqs,lab
703,95747,ATHTR-265-A,58149.0,REGE,221,,Y,,Y,,,,W,A,TR,Clin I: Intro to Ath Training,4,K.Agena,"09/03/2015-12/10/2015 Lecture Tuesday, Thursday 11:00AM - 12:30PM, Regents Center, Room 221","This course will provide instruction, practice, and testing of selected athletic training clinical proficiencies.  The primary focus will be on injury prevention and acute care skills.  Students are required to complete 125 field experience hours supervised by Approved Clinical Instructor. Requires sophomore standing.",Regents Center,K,Agena,Sciences,ATHTR,Atheltic Training,265,0,Fall 2015,9/2/2015,12/17/2015,11:00,12:30,,,,0.0,,Consent of instructor required.  Open to sophomores or above who have been accepted into the athletic training program.   Corequisite:PE-251.,,PE-251,
704,96774,ENG-485-A,58150.0,MAIN,113,,Y,,Y,,,,W,A,TR,Sem: Drama and/in time,4,L.Row-Heyveld,"09/03/2015-12/10/2015 Seminar Tuesday, Thursday 02:30PM - 04:00PM, Main, Room 113","Contemporary popular drama increasingly leans towards movie franchises and years-long TV series. There is a rich tradition of sophisticated, complex serial drama stretching back centuries. This course will examine long-form drama, investigating the dramatic features, thematic preoccupations, and narrative structures common to this tradition. Reading multiple play cycles (Aeschylus' Oresteia, Shakespeare's Henry VI plays, and Tony Kushner's Angels in America) and watching one season of a TV show (HBO's Deadwood), we will explore the way in which serial performances lend themselves to questions of time and narrative, history and memory, performativity and representation, justice and religion, and, especially, the construction of community. ",Main Building,L,Row-Heyveld,Humanities,ENG,English,485,0,Fall 2015,9/2/2015,12/17/2015,14:30,16:00,,,,0.0,,,,,
705,95961,ENG-490-A,58151.0,ARR,ARR,,,,,,,,W,A,,Senior Project,1,"N.Barry,D.Faldet,M.Klammer,N.Preus","09/02/2015-12/17/2015 Independent Studies Days to be Announced, Times to be AnnouncedArranged, Room ARR","Together with the required Senior Seminar, the Senior Project is the English major's culminating experience.  Projects build upon students' previous experience with scholarly research, creative writing, or the secondary education program. Students wishing to do a creative writing project are expected to complete the requirements for the English Writing Emphasis major. Ideally, these students would have completed the Writing Emphasis requirements and would have had coursework and sustained writing experience in the genre of their project. At a minimum, all students wishing to do a creative writing project must be completing their third writing course during the term in which a senior project will be submitted; students intending a creative nonfiction project must have completed ENG 210, 211, or 213; students intending a poetry or fiction project must have copleted ENG 212, and must have completed or be completing ENG 312 during the term in which the senior project will be submitted.   Permission to register for a Senior Project will be given after submission of the application form available on the English department website. The application form also outlines the require oral presentation component. Registration ought to be completed during the semester preceding the semester in which the project is begun. The English department does not require students with more than one major to complete an English Senior Project.",To be Announced,"N, D, M, N","Barry, Faldet, Klammer, Preus",Humanities,ENG,English,490,0,Fall 2015,9/2/2015,12/17/2015,NA,NA,,,,4.0,,Consent of instructor.,,,
706,95896,EDUC-220-A,58152.0,KORE,216,Y,,Y,,Y,,,W,A,MWF,Educational Psychology,4,D.Vesperman,"09/02/2015-12/17/2015 Lecture Monday, Wednesday, Friday 01:30PM - 02:30PM, Koren, Room 216","This course is an introduction to the field of education and to educational psychology.  One of the central concerns of every society, education involves the study of human growth and development, especially in the context of schooling.  Students will encounter research into how humans learn, how learning environments are structured, and how underlying social assumptions intersect with learning theories.  The course will explore such topics as socialization, teacher/student interaction, social and cognitive learning theories, testing and assessment, and ethics and the school.",Koren,D,Vesperman,Social Sciences,EDUC,Education,220,0,Fall 2015,9/2/2015,12/17/2015,13:30,14:30,HBSSM,Human Behavior Social Science Methods,,0.0,HB,,,,
707,96445,PE-190-A,58153.0,REGE,224,Y,,Y,,Y,,,W,A,MWF,First Aid,1,L.Huber,"10/26/2015-12/17/2015 Lecture - Second 7 Weeks Monday, Wednesday, Friday 08:00AM - 09:00AM, Regents Center, Room 224","Instruction, preparation, and practice in first aid techniques, principles, and procedures necessary in providing emergency care. The test for First Aid and CPR certification from either the American Red Cross or the American Heart Association will be administered to students enrolled in this course. Students successfully meeting the minimum standards set by the appropriate agency will be certified.",Regents Center,L,Huber,Sciences,PE,Physical Education,190,2,Fall 2015,10/26/2015,12/17/2015,8:00,9:00,,,,0.0,,Friday is lab. $27 fee. Does not apply toward PE skills requirement. 2nd 7 weeks.,,,
708,95897,EDUC-220-B,58154.0,KORE,120,,Y,,Y,,,,W,A,TR,Educational Psychology,4,S.Sovereign,"09/03/2015-12/10/2015 Lecture Tuesday, Thursday 08:00AM - 09:30AM, Koren, Room 120","This course is an introduction to the field of education and to educational psychology.  One of the central concerns of every society, education involves the study of human growth and development, especially in the context of schooling.  Students will encounter research into how humans learn, how learning environments are structured, and how underlying social assumptions intersect with learning theories.  The course will explore such topics as socialization, teacher/student interaction, social and cognitive learning theories, testing and assessment, and ethics and the school.",Koren,S,Sovereign,Social Sciences,EDUC,Education,220,0,Fall 2015,9/2/2015,12/17/2015,8:00,9:30,HBSSM,Human Behavior Social Science Methods,,0.0,HB,,,,
709,96450,PE-247-A,58155.0,REGE,218,Y,,Y,,Y,,,W,A,MWF,Found of Physical Educ,2,E.Drewes-Stoen,"10/26/2015-12/17/2015 Lecture - Second 7 Weeks Monday, Wednesday, Friday 09:15AM - 10:15AM, Regents Center, Room 218","An introductory course involving historical, philosophical, and sociologial foundations of the physical education exercise science, and sport. An overview of the field, as well as contemporary issues concerning physical education and the related areas of exercise science and sport, are examined.  Emphasis is placed upon career opportunities in this multi-faceted profession. Recommended for first-year and sophomore students.",Regents Center,E,Drewes-Stoen,Sciences,PE,Physical Education,247,2,Fall 2015,10/26/2015,12/17/2015,9:15,10:15,,,,0.0,,2nd 7 weeks only,,,
710,96453,PE-260-A,58156.0,REGE,224,Y,,Y,,Y,,,W,A,MWF,Adaptive Physical Educ,4,J.Wettach,"09/02/2015-12/17/2015 Lecture Monday, Wednesday, Friday 09:15AM - 10:15AM, Regents Center, Room 224","A study of the nature of neuromuscular and skeletal-muscular limitations of an atypical student and the methods of adapting physical and recreational activities to fit the student's needs and abilities. The primary emphasis is on experiental learning. Luther students work individually with young students (ages 3-18) from local and area school districts, to adopt activities to their special needs.",Regents Center,J,Wettach,Sciences,PE,Physical Education,260,0,Fall 2015,9/2/2015,12/17/2015,9:15,10:15,,,,0.0,,,,,
711,95898,EDUC-220-C,58158.0,KORE,120,,Y,,Y,,,,W,A,TR,Educational Psychology,4,H.Snell-Anderson,"09/03/2015-12/10/2015 Lecture Tuesday, Thursday 12:45PM - 02:15PM, Koren, Room 120","This course is an introduction to the field of education and to educational psychology.  One of the central concerns of every society, education involves the study of human growth and development, especially in the context of schooling.  Students will encounter research into how humans learn, how learning environments are structured, and how underlying social assumptions intersect with learning theories.  The course will explore such topics as socialization, teacher/student interaction, social and cognitive learning theories, testing and assessment, and ethics and the school.",Koren,H,Snell-Anderson,Social Sciences,EDUC,Education,220,0,Fall 2015,9/2/2015,12/17/2015,12:45,14:15,HBSSM,Human Behavior Social Science Methods,,0.0,HB,,,,
712,95901,EDUC-223-A,58161.0,PREU,CURR,,Y,,,,,,W,A,T,Children's Literature,2,D.Norland,"09/08/2015-12/08/2015 Lecture Tuesday 02:30PM - 04:00PM, Preus Library, Room CURR",This course introduces the study of children's literature including promoting child development through literature and analyses of books in each genre. Requires sophomore standing.,Preus Library,D,Norland,Social Sciences,EDUC,Education,223,0,Fall 2015,9/2/2015,12/17/2015,14:30,16:00,,,,0.0,,,,,
713,95903,EDUC-240-A,58162.0,MAIN,112,,,,Y,,,,W,A,R,Home School Community,2,J.Leet-Otley,"09/03/2015-12/10/2015 Lecture Thursday 02:30PM - 04:00PM, Main, Room 112","This pre-K to 12 course examines the dynamic relationship between families, school, and the community. Evaluation, legal aspects, and services to preschool students with disabilities including the Individualized Family Service Plan (IFSP) will be explored. The course offers continued focus on collaborative team efforts and the importance of establishing strong links between home, school, and other service providers so the learning experiences of students from preschool through transition to the adult life are maximized.",Main Building,J,Leet-Otley,Social Sciences,EDUC,Education,240,0,Fall 2015,9/2/2015,12/17/2015,14:30,16:00,,,,0.0,,,,,
714,96452,PE-251-A,58163.0,REGE,224,Y,,Y,,Y,,,W,A,MWF,Care/Prev of Ath Inj,2,K.Agena,"09/02/2015-10/23/2015 Lecture - First 7 Weeks Monday, Wednesday, Friday 11:00AM - 12:00PM, Regents Center, Room 224",Instruction and practice in the recognition and inital care of injuries to physically active individuals. Instruction and practice in preventative measures and first aid techniques relating primarily to settings in physical education and athletics. ,Regents Center,K,Agena,Sciences,PE,Physical Education,251,1,Fall 2015,9/2/2015,10/23/2015,11:00,12:00,,,,0.0,,First 7 weeks,,,
715,95904,EDUC-242-A,58164.0,KORE,117,Y,,Y,,Y,,,W,A,MWF,Learning Dis/Behavioral Issues,4,J.Leet-Otley,"09/02/2015-12/11/2015 Lecture Monday, Wednesday, Friday 01:30PM - 02:30PM, Koren, Room 117","This K-12 introductory course includes a historical perspective to the field of learning disabilities and behavioral disorders. This course covers characteristics and etiology, definitions and identification procedures, treatment and intervention, instructional and behavioral methodologies, impact of the disability throughout the lifespan, and current issues in the field.",Koren,J,Leet-Otley,Social Sciences,EDUC,Education,242,0,Fall 2015,9/2/2015,12/17/2015,13:30,14:30,,,,0.0,,,,,
716,95905,EDUC-245-A,58165.0,KORE,120,Y,,,,,,,W,A,M,Career/Vocational Assessment,2,A.Hagensick,"09/07/2015-10/19/2015 Lecture - First 7 Weeks Monday 06:00PM - 09:00PM, Koren, Room 120","This K-12 course covers the assessment of career/vocational skills and interests, aspects of the Individuals with Disabilities Education Improvement Act (IDEIA) which specifically address transition, transition meetings, Individualized Education Programs (IEP), community-based instruction, and the school/community services and service providers who would be involved in student transition. ",Koren,A,Hagensick,Social Sciences,EDUC,Education,245,1,Fall 2015,9/2/2015,10/23/2015,18:00,21:00,,,,0.0,,First seven weeks,,,
717,96454,PE-261-A,58166.0,REGE,224,Y,,Y,,Y,,,W,A,MWF,Applied Human Anatomy,2,B.Solberg,"09/02/2015-10/23/2015 Lecture - First 7 Weeks Monday, Wednesday, Friday 01:30PM - 02:30PM, Regents Center, Room 224","A study of the essential features of anatomy with special reference to the principles of structure in the human body. Applications of human anatomy to health, athletic injury, movement and principles of sports skills will be made. (NWNL when combined with PE 365)",Regents Center,B,Solberg,Sciences,PE,Physical Education,261,1,Fall 2015,9/2/2015,10/23/2015,13:30,14:30,,,,0.0,,First 7 weeks,,,
718,95906,EDUC-252-A,58167.0,KORE,117,,Y,,,,,,W,A,T,Intro Middle/HS 5-12 Methods,2,D.Vesperman,"09/02/2015-12/17/2015 Lecture Tuesday 02:30PM - 04:00PM, Koren, Room 117","An introduction to the general methods of secondary teaching. Such topics as objectives, planning, testing, evaluation, classroom management, instructional techniques, educational technology, media, and the inclusion of special education students in the regular classroom will be considered. Should be taken as close to EDUC 352 as possible.  Required for certification in K-12 health and 5-12 secondary education areas. Not required of K-12 art, K-12 physical education, and K-12 music majors.",Koren,D,Vesperman,Social Sciences,EDUC,Education,252,0,Fall 2015,9/2/2015,12/17/2015,14:30,16:00,,,,0.0,,,,,
719,95912,EDUC-278-A,58169.0,PREU,CURR,,,,Y,,,,W,A,R,"Content Area Read, Midl/Second",2,D.Norland,"09/02/2015-12/17/2015 Lecture Thursday 02:30PM - 04:00PM, Preus Library, Room CURR","Introduction to the teaching of reading in content areas for secondary teachers:  procedures used in recognizing content area reading problems, improving content area reading by developing literacy strategies in reading, writing, speaking, and listening.  Required for all students seeking secondary school licensure and students seeking health certification. Students are strongly encouraged, but not yet required, to take the EDUC 378 practicum while student teaching since a practicum in content area is required in several states. ",Preus Library,D,Norland,Social Sciences,EDUC,Education,278,0,Fall 2015,9/2/2015,12/17/2015,14:30,16:00,,,,0.0,,,,,
720,96446,PE-221-A,58170.0,REGE,DS,,Y,,Y,,,,W,A,TR,Lifetime Skills and Activites,2,"S.Pasche,A.Bailey,D.Kohut","09/02/2015-12/17/2015 Lecture Tuesday, Thursday 08:00AM - 09:30AM, Regents Center, Room DS (more)...","This course will provide students with instruction and participation in selected physical activities and lifetime skills.  In addition, students will receive specialized instruction that focuses on preparation and implementation of these activities in education, corporate, or commercial settings where exercise programming is a primary focus.  Activity selections will vary depending upon societal or industry trends.",Regents Center,"S, A, D","Pasche, Bailey, Kohut",Sciences,PE,Physical Education,221,0,Fall 2015,9/2/2015,12/17/2015,8:00,9:30,,,,0.0,,,,,
721,96446,PE-221-A,58279.0,REGE,LGND,,Y,,Y,,,,W,A,TR,Lifetime Skills and Activites,2,"S.Pasche,A.Bailey,D.Kohut","09/02/2015-12/17/2015 Lecture Tuesday, Thursday 08:00AM - 09:30AM, Regents Center, Room DS (more)...","This course will provide students with instruction and participation in selected physical activities and lifetime skills.  In addition, students will receive specialized instruction that focuses on preparation and implementation of these activities in education, corporate, or commercial settings where exercise programming is a primary focus.  Activity selections will vary depending upon societal or industry trends.",Regents Center,"S, A, D","Pasche, Bailey, Kohut",Sciences,PE,Physical Education,221,0,Fall 2015,9/2/2015,12/17/2015,8:00,9:30,,,,0.0,,,,,
722,96449,PE-229-A,58171.0,REGE,218,,Y,,Y,,,,W,A,TR,"El PE, Hlth & Well;Meth&Mat",2,E.Drewes-Stoen,"10/26/2015-12/17/2015 Lecture - Second 7 Weeks Tuesday, Thursday 11:00AM - 12:30PM, Regents Center, Room 218","Required for elementary (K-8) majors, this course provides students with a strong foundation in elementary physical education content, basic health concepts, and methods, with an emphasis on developmentally appropriate physical education.  Designed to introduce elementary education majors to the dynamic and rapidly changing field of elementary physical education, this course will: 1)familiarize students with current terminology and trends; 2) explore various activities, materials, units, teaching techniques, and methods of instruction; and 3) integrate elementary physical education with basic health, fitness, and wellness concepts.  Practical teaching experiences are included with emphasis on unit and lesson planning, and implementation.",Regents Center,E,Drewes-Stoen,Sciences,PE,Physical Education,229,2,Fall 2015,10/26/2015,12/17/2015,11:00,12:30,,,,0.0,,Second seven weeks. Prerequisite:Educ 185/215 ,Educ 185/215 ,,
723,96459,PE-490-A,58172.0,ARR,ARR,,,,,,,,W,A,,Senior Project,1,E.Drewes-Stoen,"09/02/2015-12/17/2015 Independent Studies Days to be Announced, Times to be AnnouncedArranged, Room ARR",,To be Announced,E,Drewes-Stoen,Sciences,PE,Physical Education,490,0,Fall 2015,9/2/2015,12/17/2015,NA,NA,,,,0.0,,,,,
724,96448,PE-226-A,58173.0,REGE,305,,Y,,Y,,,,W,A,TR,ST: Ropes/Chall Crse Prog:The,2,J.Boeke,"09/02/2015-10/23/2015 Lecture - First 7 Weeks Tuesday, Thursday 12:45PM - 02:15PM, Regents Center, Room 305",In this course students will study the integration of ropes/challenge course programming in Physical Education. This course prepares students to use and implement ropes/challenge course curriculum in elementary and secondary physical education. Students who successfully complete the course will test for Level 1 Challenge Course Certification endorsed by the ACCT (Association of Challenge Course Technology). Students will become aware of and understand the use of adventure activities and ropes/challenge course programming for various purposes and various populations. Prerequisite: PE 110 Ropes Course suggested.,Regents Center,J,Boeke,Sciences,PE,Physical Education,226,1,Fall 2015,9/2/2015,10/23/2015,12:45,14:15,,,,0.0,,First seven weeks., PE 110 Ropes Course suggested,,
725,96456,PE-345-A,58174.0,REGE,224,,Y,,Y,,,,W,A,TR,Mid/Sec Sch Pe Cont Mth/As I,2,E.Drewes-Stoen,"10/26/2015-12/17/2015 Lecture - Second 7 Weeks Tuesday, Thursday 12:45PM - 02:15PM, Regents Center, Room 224","This course provides the knowledge, theory and practical application of physical education within the middle and secondary school setting, according to NASPE standards. Students will explore various teaching techniques, class and behavior management strategies, and methods used to teach and evaluate middle and high school students. Students will: 1) design and implement course unit and lesson plans; 2) develop appropriate skill practice sessions; 3) evaluate activities and cognitive knowledge appropriate for middle and secondary students, and, 4) discuss the importance of becoming a reflective practitioner.",Regents Center,E,Drewes-Stoen,Sciences,PE,Physical Education,345,2,Fall 2015,10/26/2015,12/17/2015,12:45,14:15,,,,0.0,,Second seven weeks.Prerequisite:PE 343 and admittance to teacher education program,PE 343 and admittance to teacher education program,,
726,96455,PE-343-A,58175.0,REGE,224,,Y,,Y,,,,W,A,TR,"El Sch Pe Cont, Meth Assess I",2,E.Drewes-Stoen,"09/02/2015-10/23/2015 Lecture - First 7 Weeks Tuesday, Thursday 12:45PM - 02:15PM, Regents Center, Room 224","This course is an examination of the teaching techniques, strategies, practical applications, and methods commonly used by master teachers of elementary physical education (K-6), according to NASPE standards.  Emphasis is placed upon lesson and unit planning, evaluation procedures, class and behavior management, teaching strategies, health promotion concepts, assessment, reflection, and the importance of physical education as an integral part of general education.",Regents Center,E,Drewes-Stoen,Sciences,PE,Physical Education,343,1,Fall 2015,9/2/2015,10/23/2015,12:45,14:15,,,,0.0,,"First seven weeks. Prerequisite:Admission to Teacher Education Program, Educ 185/215, PE 247; or consent of instructor.","Admission to Teacher Education Program, Educ 185/215, PE 247; or consent of instructor",,
727,95915,EDUC-325-A,58177.0,KORE,120,Y,,Y,,Y,,,W,A,MWF,Mathematics Methods,4,J.Pillsbury,"09/02/2015-12/17/2015 Lecture Monday, Wednesday, Friday 08:00AM - 09:00AM, Koren, Room 120","This course is an introduction to the pedology and curriculum of a NCTM standards-based mathematics program in the elementary/middle school. Using the content strands of statistics/probability, data analysis and number operations, the course includes planning, teaching, assessment, diagnosis and evaluation of student learning in mathematics. This course will present current best-practice, research-based instructional methods in mathematical processes, the use of technology in teaching/student learning and classroom management as it applies to mathematics.",Koren,J,Pillsbury,Social Sciences,EDUC,Education,325,0,Fall 2015,9/2/2015,12/17/2015,8:00,9:00,,,,0.0,,Prerequisite: Admission to Teacher Education Program. Co-requisite with Math 123 and Educ 326. Students may be moved to keep sections even., Admission to Teacher Education Program, with Math 123 and Educ 326,
728,95916,EDUC-325-B,58178.0,KORE,120,Y,,Y,,Y,,,W,A,MWF,Mathematics Methods,4,J.Pillsbury,"09/02/2015-12/17/2015 Lecture Monday, Wednesday, Friday 09:15AM - 10:15AM, Koren, Room 120","This course is an introduction to the pedology and curriculum of a NCTM standards-based mathematics program in the elementary/middle school. Using the content strands of statistics/probability, data analysis and number operations, the course includes planning, teaching, assessment, diagnosis and evaluation of student learning in mathematics. This course will present current best-practice, research-based instructional methods in mathematical processes, the use of technology in teaching/student learning and classroom management as it applies to mathematics.",Koren,J,Pillsbury,Social Sciences,EDUC,Education,325,0,Fall 2015,9/2/2015,12/17/2015,9:15,10:15,,,,0.0,,Prerequisite: Admission to Teacher Education Program Co-requisite with Math 123 & Educ 326. Students may be moved to keep sections even., Admission to Teacher Education Program Co-requisite with Math 123 & Educ 326, with Math 123 & Educ 326,
729,95917,EDUC-326-A,58179.0,KORE,117,Y,,Y,,Y,,,W,A,MWF,Language Art Methods,4,J.Meyer-Mork,"09/02/2015-12/17/2015 Lecture Monday, Wednesday, Friday 11:00AM - 12:00PM, Koren, Room 117","This course is an introduction to oral and written communication for the twenty-first century, the curriculum and pedagogy of a language arts program based on standards established by the International Reading Association and the National Council of Teachers of English, and the eight components of the language arts in the elementary classroom. It will include integration of the language arts (to include reading/literature, writing/grammar, speaking, viewing, listening and spelling), the use of technology in teaching language arts, and classroom management as it applies to language arts instruction.  The course utilizes a comprehensive approach that examines language acquisition and development.  It is also the writing-intensive course in the major.",Koren,J,Meyer-Mork,Social Sciences,EDUC,Education,326,0,Fall 2015,9/2/2015,12/17/2015,11:00,12:00,,,,0.0,,Prerequisite: Admission to Teacher Education Program.Co-requisite Educ 325 and Math 123. Students may be moved to keep sections even., Admission to Teacher Education Program, Educ 325 and Math 123,
730,95918,EDUC-326-B,58180.0,KORE,117,Y,,Y,,Y,,,W,A,MWF,Language Art Methods,4,J.Meyer-Mork,"09/02/2015-12/17/2015 Lecture Monday, Wednesday, Friday 12:15PM - 01:15PM, Koren, Room 117","This course is an introduction to oral and written communication for the twenty-first century, the curriculum and pedagogy of a language arts program based on standards established by the International Reading Association and the National Council of Teachers of English, and the eight components of the language arts in the elementary classroom. It will include integration of the language arts (to include reading/literature, writing/grammar, speaking, viewing, listening and spelling), the use of technology in teaching language arts, and classroom management as it applies to language arts instruction.  The course utilizes a comprehensive approach that examines language acquisition and development.  It is also the writing-intensive course in the major.",Koren,J,Meyer-Mork,Social Sciences,EDUC,Education,326,0,Fall 2015,9/2/2015,12/17/2015,12:15,13:15,,,,0.0,,Prerequisite: Admission to Teacher Education Program. Co-requisite Educ 325 amd Math 123. Students may be moved to keep sections even., Admission to Teacher Education Program, Educ 325 amd Math 123,
