"Course Sections Id","Sec Name","Sec Short Title","Sec Min Cred","Sec Max Cred","Faculty First Initial & Last CSV","Sec Start Date","Sec End Date","Sec Status","Sec Printed Comments","Sec Meeting Info","Crs Desc","Course Types CSV"
"97148","ACCTG-354-A","Intermediate Accounting II","4","","R.Nelson","2016/02/04 00:00:00","2016/05/19 00:00:00","A","","02/04/2016-05/19/2016 Lecture Monday, Wednesday, Friday 12:15PM - 01:15PM, Olin, Room 208","Further coverage of financial accounting concepts and practice. Includes intensive coverage of the stockholders' equity section of the balance sheet, the statement of changes in financial position, and other special topics, including pension costs, leases, and income tax allocation.",""
"97962","PSYC-468-A","Intro to Counseling","4","","J.Breitenstein","2016/02/04 00:00:00","2016/05/19 00:00:00","A","","02/04/2016-05/19/2016 Lecture Tuesday, Thursday 08:00AM - 09:30AM, Valders, Room 345","An introduction to models of counseling with emphasis on selected processes and skills necessary to apply the models in a variety of settings. One class meeting per week is devoted to practice of skills. Other topics include professional ethics and the efficacy of major models of counseling.",""
"97963","PSYC-468-B","Intro to Counseling","4","","J.Breitenstein","2016/02/04 00:00:00","2016/05/19 00:00:00","A","","02/04/2016-05/19/2016 Lecture Tuesday, Thursday 11:00AM - 12:30PM, Valders, Room 345","An introduction to models of counseling with emphasis on selected processes and skills necessary to apply the models in a variety of settings. One class meeting per week is devoted to practice of skills. Other topics include professional ethics and the efficacy of major models of counseling.",""
"97161","ANTH-101-A","Cultural Anthropology","4","","L.Stanley","2016/02/04 00:00:00","2016/05/19 00:00:00","A","","02/04/2016-05/19/2016 Lecture Monday, Wednesday, Friday 09:15AM - 10:15AM, Koren, Room 216","A study in what it means to be human, this course uses the concept of culture to account for the tremendous variety of practices and beliefs throughout the world. Students will also examine patterns in human behavior, addressing cultural similarities as well as cultural differences. Course content provides insight into how cultural anthropologists do what they do - what methods they use to study culture and what ethical issues they may encounter while doing so. Students will be expected to engage some of these anthropological methods by completing a series of ethnographic exercises.  Through the study of anthropological works and practice with ethnographic methods, the course will prepare students to apply the anthropological approach as they navigate an increasingly diverse and globalized world.","FY,GL,SS,PBK,HBSSM,INTCL,ENVMJ"
"97162","ANTH-101-B","Cultural Anthropology","4","","A.Carrasco","2016/02/04 00:00:00","2016/05/19 00:00:00","A","","02/04/2016-05/19/2016 Lecture Monday, Wednesday, Friday 11:00AM - 12:00PM, Koren, Room 217","A study in what it means to be human, this course uses the concept of culture to account for the tremendous variety of practices and beliefs throughout the world. Students will also examine patterns in human behavior, addressing cultural similarities as well as cultural differences. Course content provides insight into how cultural anthropologists do what they do - what methods they use to study culture and what ethical issues they may encounter while doing so. Students will be expected to engage some of these anthropological methods by completing a series of ethnographic exercises.  Through the study of anthropological works and practice with ethnographic methods, the course will prepare students to apply the anthropological approach as they navigate an increasingly diverse and globalized world.","FY,GL,SS,PBK,HBSSM,INTCL,ENVMJ"
"97163","ANTH-101-C","Cultural Anthropology","4","","M.Bazylevych","2016/02/04 00:00:00","2016/05/19 00:00:00","A","","02/04/2016-05/19/2016 Lecture Monday, Wednesday, Friday 01:30PM - 02:30PM, Valders, Room 254","A study in what it means to be human, this course uses the concept of culture to account for the tremendous variety of practices and beliefs throughout the world. Students will also examine patterns in human behavior, addressing cultural similarities as well as cultural differences. Course content provides insight into how cultural anthropologists do what they do - what methods they use to study culture and what ethical issues they may encounter while doing so. Students will be expected to engage some of these anthropological methods by completing a series of ethnographic exercises.  Through the study of anthropological works and practice with ethnographic methods, the course will prepare students to apply the anthropological approach as they navigate an increasingly diverse and globalized world.","FY,GL,SS,PBK,HBSSM,INTCL,ENVMJ"
"97976","REL-112-A","Intro to the New Test Studies","4","","G.Nave","2016/02/04 00:00:00","2016/05/19 00:00:00","A","First year students only.","02/04/2016-05/19/2016 Lecture Monday, Wednesday, Friday 12:15PM - 01:15PM, Main, Room 214","An introduction to the academic study of the literture of the New Testament with an emphasis on selected, writings, themes, and methods of interpretation. Students will also become familiar with extra-biblical sources (textual and archaeological) which contribute to understanding the New Testament in its historical, socio-economic, theological, and literary contexts. Students who earn credit for REL 112 may earn credit for REL 111 but not for REL 101.","BL,RP,PBK,REL"
"97965","PSYC-490-A","Senior Project","1","4","D.Bishop,J.Breitenstein,K.Gould,D.Njus,L.Toussaint,S.Travers,J.Sprung","2016/02/04 00:00:00","2016/05/19 00:00:00","A","","02/04/2016-05/19/2016 Independent Studies Days to be Announced, Times to be AnnouncedArranged, Room ARR","","PBK"
"98335","PSYC-493-A","Senior Honors Project","4","","J.Breitenstein,D.Njus","2016/02/04 00:00:00","2016/05/19 00:00:00","A","","02/04/2016-05/19/2016 Independent Studies Days to be Announced, Times to be AnnouncedArranged, Room ARR","A year-long independent research project. Applications are completed on the ""Honors Program"" form available at the registrar's office, requiring the signatures of a faculty supervisor, the department head, the honors program director, and the registrar. Interdisciplinary projects require the signatures of two faculty supervisors. The project must be completed by the due date for senior projects. The completed project is evaluated by a review committee consisting of the faculty supervisor, another faculty member from the major department, and a faculty member from outside the major department. All projects must be presented publicly. Only projects awarded an ""A- or A"" qualify for ""department honors"" designation. The honors project fulfills the all-college senior project requirement.","HON,PBK"
"97994","RUS-102-A","Beginning Russian II","4","","L.Iudin-Nelson","2016/02/04 00:00:00","2016/05/19 00:00:00","A","Completion of Russian 101 or consent of  instructor.","02/04/2016-05/19/2016 Lecture Monday, Wednesday, Friday 09:15AM - 10:15AM, Main, Room 211","Introduction to Russian grammar through reading, writing, listening, and speaking in Russian. The course will focus upon developing speaking and listening comprehension skills with a framework of practical vocabulary and grammatical structures. The student will also gain an appreciation of Russian culture and contemporary life through music and audiovisual materials.","PBK"
"97988","REL-261-A","Religions of South Asia","4","","S.Hurley","2016/02/04 00:00:00","2016/05/19 00:00:00","A","Course can only fulfill either REL or HEPT general education requirement, not both.","02/04/2016-05/19/2016 Lecture Monday, Wednesday, Friday 08:00AM - 09:00AM, Ockham House, Room 103","This course will introduce the religious and philosophical traditions of South Asia. Particularly, it will focus on historical, textual, and doctrinal foundations of Hinduism, Buddhism, Jainism, and Sikhism. It will analyze excerpts of their sacred scriptures, survey their beliefs, study their practices, and explore their ethical systems. Additional consideration will be given to contemporary issues facing these traditions.","RP,GL,PBK,REL,HEPT,INTCL"
"98114","REL-261-B","Religions of South Asia","4","","S.Hurley","2016/02/04 00:00:00","2016/05/19 00:00:00","A","Course can only fulfill wither REL or HEPT gen ed req, not both","02/04/2016-05/19/2016 Lecture Monday, Wednesday, Friday 12:15PM - 01:15PM, Ockham House, Room 103","This course will introduce the religious and philosophical traditions of South Asia. Particularly, it will focus on historical, textual, and doctrinal foundations of Hinduism, Buddhism, Jainism, and Sikhism. It will analyze excerpts of their sacred scriptures, survey their beliefs, study their practices, and explore their ethical systems. Additional consideration will be given to contemporary issues facing these traditions.","RP,GL,PBK,REL,HEPT,INTCL"
"97995","RUS-202-A","Intermediate Russian","4","","L.Iudin-Nelson","2016/02/04 00:00:00","2016/05/19 00:00:00","A","Completion of Russian 101 or consent of  instructor.","02/04/2016-05/19/2016 Lecture Monday, Wednesday, Friday 11:00AM - 12:00PM, Main, Room 211","A continuation of the study of Russian grammar. Speaking proficiency will be developed through active class participation. Emphasis will be placed on developing writing skills in Russian and in reading authentic texts. Students will continue developing listening comprehension skills through use of music and audiovisual materials.","PBK"
"97978","REL-222-A","Religion in America","4","","T.Green","2016/02/04 00:00:00","2016/05/19 00:00:00","A","Course can only fulfill either REL or HB gen ed req, not both.","02/04/2016-05/19/2016 Lecture Tuesday, Thursday 08:00AM - 09:30AM, Main, Room 111","A historical survey of the role of religion in American life, focusing on the interaction between religion and culture in the United States. The course will examine the development of religious pluralism in the U.S. and explore selected issues that have arisen and continue to affect American culture, such as religious liberty, revivalism, utopianism, immigration and ethnicity, slavery, fundamentalism, and the contributions of women and minorities.","RP,PBK,REL,HB,HIST"
"97979","REL-230-A","Philosophy of Religion","4","","G.Kopf","2016/02/04 00:00:00","2016/05/19 00:00:00","A","Course can fulfill either REL OR HEPT gen educ requirement, but not both.","02/04/2016-05/19/2016 Lecture Tuesday, Thursday 12:45PM - 02:15PM, Ockham House, Room 103","A study of attempts to bring rational justification and clarification to religious beliefs and practice, focusing primarily on the concepts of Christian theology. Topics will include: the existence and attributes of God, faith and reason, death and immortality, miracles and revelation, the problem of evil, and religious pluralism. (Same as philosophy 130.) Prerequisite: one of 101, 111, or 112.","RP,PBK,HEPT,REL"
"97980","REL-230-B","Philosophy of Religion","4","","G.Kopf","2016/02/04 00:00:00","2016/05/19 00:00:00","A","Course can only fulfill either REL or HEPT gen ed req, not both","02/04/2016-05/19/2016 Lecture Tuesday, Thursday 02:30PM - 04:00PM, Ockham House, Room 103","A study of attempts to bring rational justification and clarification to religious beliefs and practice, focusing primarily on the concepts of Christian theology. Topics will include: the existence and attributes of God, faith and reason, death and immortality, miracles and revelation, the problem of evil, and religious pluralism. (Same as philosophy 130.) Prerequisite: one of 101, 111, or 112.","RP,PBK,HEPT,REL"
"98113","REL-243-A","Environmental Ethics","4","","J.Martin-Schramm","2016/02/04 00:00:00","2016/05/19 00:00:00","A","Course  can only fulfill either REL or HEPT gen  ed req, not both","02/04/2016-05/19/2016 Lecture Tuesday, Thursday 11:00AM - 12:30PM, Valders, Room 349","A critical examination of issues in environmental ethics from diverse Christian perspectives. The course examines root causes of environmental problems, philosophical and theological assumptions about nature, and resources for response in Christian traditions. Particular attention is given to demographic and economic factors at the global level as well as personal consumption decisions at the local level. Case studies ground reflection in concrete situation. Typically offered during alternate years at Holden Village, a Lutheran retreat center in the Cascade Mountains of Washington state. Offered alternate years.","ENVMJ,PBK,REL,HEPT,RP"
"97983","REL-233-A","God and Gender","4","","W.Deifelt","2016/02/04 00:00:00","2016/05/19 00:00:00","A","Course can only fulfill either REL or HE gen ed req, not both.","02/04/2016-05/19/2016 Lecture Monday, Wednesday, Friday 01:30PM - 02:30PM, Main, Room 213","An investigation of how our understanding and experience of gender are connected to our views of God, human beings, and the natural world. The course explores the works of a variety of thinkers and pays special attention to issues raised by feminist theologians who stand both inside and outside the Christian tradition. Possible topics include: language about God, human sexuality, views of women in the Bible, the nature of biblical authority, the feminist movement, the men's movement, images of nature in Western religious thought, and the ordination of women. (Same as WGST 337)","WGSMJ,RP,PBK,REL,HE,INTCL"
"98314","REL-316-A","Jesus and the Gospels","4","","S.Burke","2016/02/04 00:00:00","2016/05/19 00:00:00","A","This course will apply toward the REL or HEPT requirement, but not both. ","02/04/2016-05/12/2016 Lecture Tuesday, Thursday 12:45PM - 02:15PM, Main, Room 111","An examination of the different ways in which the Jesus tradition was assimilated in the first two centuries of the Common Era. The course centers its attention on the four New Testament portraits of Jesus because they became the accepted interpretation of Jesus. Those portraits will be compared and contrasted with other ancient options available from recent discoveries. Topics studied will include: the canonical Gospels and the Synoptic problem, several non-canonical Gospels (including especially the Gospel according to Thomas), and the quest for the historical Jesus.","RP,PBK,REL,HEPT"
"97251","CHEM-114-A","The Enviro: a Chemical Persp","4","","C.Mertzenich","2016/02/04 00:00:00","2016/05/19 00:00:00","A","Register for lecture and a lab. ","02/04/2016-05/19/2016 Lecture Tuesday, Thursday 11:00AM - 12:30PM, Olin, Room 102","A study of the environment with emphasis on the relationship between technology and our surroundings. Laboratory work may include field studies in the surrounding area. The course is designed for non-science students with little or no science background. (Students who earn credit for 114 may not earn credit for CHEM 116).","NSL,PBK,NWL,ENVMJ"
"97992","REL-490-A","Senior Project","1","4","S.Burke","2016/02/04 00:00:00","2016/05/19 00:00:00","A","","02/04/2016-05/19/2016 Independent Studies Days to be Announced, Times to be Announced, Room to be Announced","","PBK"
"97999","SCI-110-A","Medical Terminology","1","","J.Edrington","2016/02/04 00:00:00","2016/05/19 00:00:00","A","","02/04/2016-05/19/2016 Lecture Days to be Announced, Times to be AnnouncedArranged, Room ARR","This course is designed to meet the needs of students anticipating careers in the health sciences. The course will focus on the origin and contemporary meaning of medical terms. This course does not count toward the natural science requirement.",""
"98000","SCI-111-A","Physical Science","4","","A.Winsauer","2016/02/04 00:00:00","2016/05/19 00:00:00","A","","02/04/2016-05/19/2016 Lecture Monday, Wednesday, Friday 08:00AM - 10:00AM, Valders, Room 282","A basic course dealing with important aspects of the physical and chemical world. Topics include the development of the scientific method, Galileo, Newton, and the study of motion, work, energy, electricity and light, elements and the Periodic Law, compounds and chemical bonds, and the chemical nature of matter. The laboratory program will stress the development of skills in designing and conducting laboratory experiments. This course is intended for the student with no special background in science or mathematics. Strongly recommended for elementary education majors.","NSL,PBK,NWL"
"97252","CHEM-114L-A01"," The Env:Chemical Persp Lab","0","","C.Mertzenich","2016/02/04 00:00:00","2016/05/19 00:00:00","A","","02/04/2016-05/19/2016 Lab Tuesday 12:45PM - 02:15PM, Sampson Hoffland Laboratories, Room 233","","PBK"
"97253","CHEM-114L-A02"," The Env:Chemical Persp Lab","0","","C.Mertzenich","2016/02/04 00:00:00","2016/05/19 00:00:00","A","","02/04/2016-05/19/2016 Lab Thursday 12:45PM - 02:15PM, Sampson Hoffland Laboratories, Room 233","","PBK"
"98006","SCST-102-A","Elementary Norwegian II","4","","K.Gronningsaeter","2016/02/04 00:00:00","2016/05/19 00:00:00","A","Completion of Scst 101 or consent of  instructor.","02/04/2016-05/19/2016 Lecture Monday, Wednesday, Friday 11:00AM - 12:00PM, Main, Room 217","Speaking Norwegian from the first day of class, students learn to apply a practical knowledge, first to their own situation in this country and subsequently to selected aspects of Norwegian culture ranging from everyday customs and manners, travel and shopping, to history, the arts and education.","PBK"
"98007","SCST-102-B","Elementary Norwegian II","4","","K.Gronningsaeter","2016/02/04 00:00:00","2016/05/19 00:00:00","A","Completion of Scst 101 or consent of  instructor.","02/05/2016-05/13/2016 Lecture Monday, Wednesday, Friday 01:30PM - 02:30PM, Main, Room 212","Speaking Norwegian from the first day of class, students learn to apply a practical knowledge, first to their own situation in this country and subsequently to selected aspects of Norwegian culture ranging from everyday customs and manners, travel and shopping, to history, the arts and education.","PBK"
"98008","SCST-102-C","Elementary Norwegian II","4","","M.Johnson","2016/02/04 00:00:00","2016/05/19 00:00:00","A","Completion of Scst 101 or consent of  instructor.","02/04/2016-05/19/2016 Lecture Monday, Wednesday, Friday 02:45PM - 03:45PM, Main, Room 217","Speaking Norwegian from the first day of class, students learn to apply a practical knowledge, first to their own situation in this country and subsequently to selected aspects of Norwegian culture ranging from everyday customs and manners, travel and shopping, to history, the arts and education.","PBK"
"98009","SCST-202-A","Intermediate Norwegian","4","","K.Gronningsaeter","2016/02/04 00:00:00","2016/05/19 00:00:00","A","Completion of Scst 201 or  consent of instructor.","02/04/2016-05/12/2016 Lecture Tuesday, Thursday 08:00AM - 09:30AM, Main, Room 218","Continuing to develop students' abilities to communicate in the language and to increase their knowledge of the country, the course combines readings from short stories, novels, and recent Norwegian feature films.  Students will be asked to conduct oral presentations, written analysis and contribute to course discussions that further their competencies in Norwegian language and the development of cultural and artistic understanding.","PBK,HE"
"98013","SOC-101-A","Intro To Sociology","4","","J.Kremer","2016/02/04 00:00:00","2016/05/19 00:00:00","A","","02/04/2016-05/19/2016 Lecture Tuesday, Thursday 11:00AM - 12:30PM, Olin, Room 106","Introduction to theoretical perspectives and foundational principles of ""thinking  sociologically."" Key concepts include: culture, inequality/poverty, deviance/crime, gender, social construction of reality, social change, and social structure.","SS,PBK,HBSSM"
"98014","SOC-101-B","Intro To Sociology","4","","C.Kunkel","2016/02/04 00:00:00","2016/05/19 00:00:00","A","","02/04/2016-05/19/2016 Lecture Monday, Wednesday, Friday 11:00AM - 12:00PM, Koren, Room 218","Introduction to theoretical perspectives and foundational principles of ""thinking  sociologically."" Key concepts include: culture, inequality/poverty, deviance/crime, gender, social construction of reality, social change, and social structure.","SS,PBK,HBSSM"
"98015","SOC-101-C","Intro To Sociology","4","","R.Ferguson","2016/02/04 00:00:00","2016/05/19 00:00:00","A","","02/04/2016-05/19/2016 Lecture Monday, Wednesday, Friday 01:30PM - 02:30PM, Larsen, Room 120","Introduction to theoretical perspectives and foundational principles of ""thinking  sociologically."" Key concepts include: culture, inequality/poverty, deviance/crime, gender, social construction of reality, social change, and social structure.","SS,PBK,HBSSM"
"98018","SOC-345-A","Constructs of Race and Racial","4","","C.Kunkel","2016/02/04 00:00:00","2016/05/19 00:00:00","A","","02/04/2016-05/19/2016 Lecture Monday, Wednesday, Friday 12:15PM - 01:15PM, Koren, Room 218","This course examines the social construction of race as a concept and the racialization of US society. An assessment of how racialization has changed over time and has created various interactions between groups from Whites and enslaved Africans, Mexicans and Native Americans to present day race relations. We also examine how racialization both determines and impacts social structures and the attainment of societal honors, rewards and power in modern society. ","WGSMJ,PBK,HBSSM,INTCL"
"98019","SOC-350-A","Social Statistics","4","","R.Ferguson","2016/02/04 00:00:00","2016/05/19 00:00:00","A","","02/04/2016-05/19/2016 Lecture Tuesday, Thursday 02:30PM - 04:00PM, Main, Room 113","A first course in applied statistics that introduces descriptive and inferential statistics with a focus on developing and testing sociological hypotheses using quantitative data. Students will use statistical software to input and analyze their own small-scale survey data, as well as develop and test hypotheses using large, publicly available sociological datasets.","PBK,HBSSM"
"98021","SOC-472-A","Sem:Social Institutions","4","","C.Kunkel","2016/02/04 00:00:00","2016/05/19 00:00:00","A","","02/04/2016-05/19/2016 Seminar Monday, Wednesday, Friday 02:45PM - 03:45PM, Larsen, Room 120","An examination of selected major social institutions in American society (family, education, religion, politics, or industry), as well as their intersections and maintenance in social life.","PBK,HBSSM"
"97256","CHEM-152-A","Chemical Principles II","4","","J.Jefferson","2016/02/04 00:00:00","2016/05/19 00:00:00","A","Register for a lecture and a lab section.  Students who earn credit for 151 may not earn credit for either 114 or 141.","02/04/2016-05/19/2016 Lecture Monday, Wednesday, Friday 09:15AM - 10:15AM, Olin, Room 102","General course intended primarily for students concentrating in the science area. Algebra skills are assumed. ","NSL,PBK,NWL,QUANT,ENVMJ"
"97257","CHEM-152-B","Chemical Principles II","4","","M.Wilker","2016/02/04 00:00:00","2016/05/19 00:00:00","A","Register for a lecture and a lab section. Students who earn credit for 151 may not earn credit for either 114 or 141.","02/04/2016-05/19/2016 Lecture Tuesday, Thursday 08:00AM - 09:30AM, Valders, Room 362","General course intended primarily for students concentrating in the science area. Algebra skills are assumed. ","NSL,PBK,NWL,QUANT,ENVMJ"
"98022","SOC-490-A","Senior Project","1","4","C.Kunkel,R.Ferguson,J.Kremer","2016/02/04 00:00:00","2016/05/19 00:00:00","A","","02/04/2016-05/19/2016 Independent Studies Days to be Announced, Times to be AnnouncedArranged, Room ARR","","PBK"
"98041","SW-101-A","Intro To Soc Work & Soc Welf","4","","B.Rhodes","2016/02/04 00:00:00","2016/05/19 00:00:00","A","","02/04/2016-05/19/2016 Lecture Monday, Wednesday, Friday 09:15AM - 10:15AM, Loyalty Hall, Room 010","A survey course covering the development of the social welfare institution and the social work profession in the United States. Included is information on how social welfare and social work impact on diverse populations, populations at risk, and promotion of social and economic justice in our society. Content on social work values and ethics is interspersed throughout the course. ","SS,HB"
"98043","SW-201-A","Fund of Social Work Pract I","4","","B.Rhodes","2016/02/04 00:00:00","2016/05/19 00:00:00","A","Consent of instructor or social work major.","02/04/2016-05/19/2016 Lecture Tuesday, Thursday 08:00AM - 09:30AM, Koren, Room 216","An introduction to the generalist method of social work practice that includes the study and practice of basic counseling skills. This course provides a foundation model for social work practice which is built and expanded upon in SW 301 and SW 401.",""
"98044","SW-204-A","Human Behv in Soc Env I","4","","B.Rhodes","2016/02/04 00:00:00","2016/05/19 00:00:00","A","","02/04/2016-05/19/2016 Lecture Tuesday, Thursday 12:45PM - 02:15PM, Koren, Room 217","This course focuses on theories of human behavior and the interaction between behavior and the social environment. The course develops a conceptual framework for social work practice by examining knowledge and theory related to the development of human behavior across the life span in relation to individuals' emotional, spiritual, physical, intellectual, social and cultural contexts.  A life cycle approach is used to understand the experience of individuals in their environment and explore theories of human behavior and responses to life cycle challenges.  Human diversity, global perspectives, and an ecosystems approach to understanding human behavior are emphasized. ","PBK,HB"
