"Course Sections Id","Sec Name","Sec Short Title","Sec Min Cred","Sec Max Cred","Faculty First Initial & Last CSV","Sec Start Date","Sec End Date","Sec Status","Sec Printed Comments","Sec Meeting Info","Crs Desc","Course Types CSV"
"98088","LING-245-A","History of Romance Languages","4","","L.Zaring","2016/02/04 00:00:00","2016/05/19 00:00:00","A","","02/04/2016-05/19/2016 Lecture Tuesday, Thursday 12:45PM - 02:15PM, Main, Room 213","Although all Romance languages have Latin as their source, each is in many ways distinct from its siblings and from Latin. This course examines the primary changes in the phonology, morphology, syntax, and lexicon of Latin as it developed into the Romance language family, and explores the relationship between the ways in which a language changes and the historical events which shape the lives of its speakers. Offered every three years.","HB,HIST,PBK"
"97400","ENG-490-A","Senior Project","1","4","N.Barry,M.Klammer,K.Lesmeister,N.Whitsitt,A.Hageman,A.Weldon,L.Row-Heyveld,A.Peterson","2016/02/04 00:00:00","2016/05/19 00:00:00","A","","02/04/2016-05/19/2016 Independent Studies Days to be Announced, Times to be AnnouncedArranged, Room ARR","Together with the required Senior Seminar, the Senior Project is the English major's culminating experience.  Projects build upon students' previous experience with scholarly research, creative writing, or the secondary education program. Students wishing to do a creative writing project are expected to complete the requirements for the English Writing Emphasis major. Ideally, these students would have completed the Writing Emphasis requirements and would have had coursework and sustained writing experience in the genre of their project. At a minimum, all students wishing to do a creative writing project must be completing their third writing course during the term in which a senior project will be submitted; students intending a creative nonfiction project must have completed ENG 210, 211, or 213; students intending a poetry or fiction project must have copleted ENG 212, and must have completed or be completing ENG 312 during the term in which the senior project will be submitted.   Permission to register for a Senior Project will be given after submission of the application form available on the English department website. The application form also outlines the require oral presentation component. Registration ought to be completed during the semester preceding the semester in which the project is begun. The English department does not require students with more than one major to complete an English Senior Project.","PBK"
"98172","WGST-130-A","Intro to Wom & Gender Studies","4","","C.Foster","2016/02/04 00:00:00","2016/05/19 00:00:00","A","","02/04/2016-05/19/2016 Lecture Tuesday, Thursday 12:45PM - 02:15PM, Koren, Room 216","The course combines a cross-cultural survey of gender diversity with a history of gender studies, emphasizing the key theories, case studies, and social, economic and political climates.  Students will explore variations in gender systems, focusing on other cultures to better understand their own.  The primary goal is to develop a set of scholarly tools that render gender a useful category of social analysis. Designed as an introduction to women and gender studies; required for the WGST major and minor.","PBK,HB"
"98327","REL-364-A","Topics in Asian Religions","4","","G.Kopf","2016/02/04 00:00:00","2016/05/19 00:00:00","A","Consent of instructor","02/04/2016-05/19/2016 Lecture Days to be Announced, Times to be AnnouncedArranged, Room ARR","This course will explore one particular topic in the field of Asian religions. Likely topics include meditation theory, nationalism and religion, and theories of justice. This course is designed  for students with a particular interest in Asian studies, religious studies, or philosophy. Offered alternate years.","RP,REL,PBK"
"97290","CLAS-490-A","Senior Project","4","","P.Freeman,D.Davis","2016/02/04 00:00:00","2016/05/19 00:00:00","A","","02/04/2016-05/19/2016 Independent Studies Days to be Announced, Times to be AnnouncedArranged, Room ARR","The senior project is a required capstone project for all classics majors in the classical studies track.  Students will work with a professor from the Classics department to develop an appropriate research project and produce a substantial research paper on their findings.",""
"97954","PSYC-349-A","Research Methods in Psychology","2","","J.Sprung","2016/02/04 00:00:00","2016/03/18 00:00:00","A","First seven weeks.","02/05/2016-03/18/2016 Lecture - First 7 Weeks Monday, Wednesday, Friday 08:00AM - 09:00AM, Valders, Room 349","This course provides an introduction to the ways in which the scientific method is applied to psychology. Attention is given to the methods used by psychologists to describe, predict, and explain psychological phenomena. Students will learn the nature of observational, quasti-experimental,and experimental methods, with a specific focus on issues of reliability and validity.","PBK"
"97951","PSYC-242-A","Evolutionary Psychology","4","","D.Bishop","2016/02/04 00:00:00","2016/05/19 00:00:00","A","","02/04/2016-05/19/2016 Lecture Monday, Wednesday, Friday 09:15AM - 10:15AM, Valders, Room 375","Evolutionary psychology applies the principles of Darwinian natural and sexual selection to the study of the human mind and behavior. The central assumption of the field is that the mind evolved to solve recurrent survival and reproduction problems in the ancestral environment. Selected topics within evolutionary psychology will be examined and critically evaluated. ","HB,PBK"
"97144","ACCTG-150-A","Fundamentals of Accounting","4","","R.Torkelson","2016/02/04 00:00:00","2016/05/19 00:00:00","A","","02/04/2016-05/19/2016 Lecture Monday, Wednesday, Friday 09:15AM - 10:15AM, Olin, Room 207","The course provides a basic understanding of financial and managerial accounting concepts, principles and procedures. Emphasis will be placed on the use of accounting information by management, creditors and stockholders. Course coverage includes accounting for inventory, receivables, long-term assets, short and long-term debt, stockholders equity, financial statement analysis, cost behavior analysis, manufacturing operations, budgeting and variance analysis. The prerequisite may be satisfied with a high school accounting/bookkeeping course.","FY,PBK"
"97145","ACCTG-150-B","Fundamentals of Accounting","4","","B.Cord","2016/02/04 00:00:00","2016/05/19 00:00:00","A","","02/04/2016-05/19/2016 Lecture Monday, Wednesday, Friday 11:00AM - 12:00PM, Olin, Room 207","The course provides a basic understanding of financial and managerial accounting concepts, principles and procedures. Emphasis will be placed on the use of accounting information by management, creditors and stockholders. Course coverage includes accounting for inventory, receivables, long-term assets, short and long-term debt, stockholders equity, financial statement analysis, cost behavior analysis, manufacturing operations, budgeting and variance analysis. The prerequisite may be satisfied with a high school accounting/bookkeeping course.","FY,PBK"
"97146","ACCTG-150-C","Fundamentals of Accounting","4","","R.Torkelson","2016/02/04 00:00:00","2016/05/19 00:00:00","A","","02/04/2016-05/19/2016 Lecture Monday, Wednesday, Friday 12:15PM - 01:15PM, Olin, Room 207","The course provides a basic understanding of financial and managerial accounting concepts, principles and procedures. Emphasis will be placed on the use of accounting information by management, creditors and stockholders. Course coverage includes accounting for inventory, receivables, long-term assets, short and long-term debt, stockholders equity, financial statement analysis, cost behavior analysis, manufacturing operations, budgeting and variance analysis. The prerequisite may be satisfied with a high school accounting/bookkeeping course.","FY,PBK"
"97147","ACCTG-250-A","Acctg for Decision Making","4","","B.Cord","2016/02/04 00:00:00","2016/05/19 00:00:00","A","","02/04/2016-05/19/2016 Lecture Monday, Wednesday, Friday 09:15AM - 10:15AM, Olin, Room 208","This course examines the central role of managerial and cost accounting in the decision-making process of an organization.  Topics include cost-volume-profit analysis, job costing, activity-based costing, flexible budgeting, variance analysis, inventory valuation, and cost behavior.",""
"97447","HIST-150-A","Europe, 1648 to the Present","4","","A.Peterson","2016/02/04 00:00:00","2016/05/19 00:00:00","A","","02/04/2016-05/19/2016 Lecture Monday, Wednesday, Friday 01:30PM - 02:30PM, Koren, Room 217","An introductory survey of European history from the end of the wars of religion in the seventeenth century to the present. Topics will include: the Scientific Revolution: the Enlightenment; Absolutism and the Emergence of the Parliamentary Government; the French Revolution and Napoleon; Reaction and Revolution in the early nineteenth century; The Industrial Revolution; Nationalism and Unification; the ""New Imperialism"" and the Coming of World War I: the ""Thirty Years War of the Twentieth Century""; Postwar Europe: Cold War and Integration.","HBSSM,SS,HIST,INTCL,PBK"
"97401","ENG-493-A","Senior Honors Project","4","","A.Hageman,A.Weldon","2016/02/04 00:00:00","2016/05/19 00:00:00","A","","02/04/2016-05/19/2016 Independent Studies Days to be Announced, Times to be AnnouncedArranged, Room ARR","A year-long independent research project. Applications are completed on the ""Honors Program"" form available at the registrar's office, requiring the signatures of a faculty supervisor, the department head, the honors program director, and the registrar. Interdisciplinary projects require the signatures of two faculty supervisors. The project must be completed by the due date for senior projects. The completed project is evaluated by a review committee consisting of the faculty supervisor, another faculty member from the major department, and a faculty member from outside the major department. All projects must be presented publicly. Only projects awarded an ""A- or A"" qualify for ""department honors"" designation. The honors project fulfills the all-college senior project requirement.","HON,PBK"
"98308","MUS-111-A","The Materials of Music","2","","L.Martin","2016/02/04 00:00:00","2016/05/19 00:00:00","A","","02/04/2016-05/19/2016 Lecture Monday, Wednesday 11:00AM - 11:40AM, Jenson Noble Hall of Music, Room 125","Students with little or no music theory background are provided an opportunity to study and make music through singing with solfege, playing the piano, composing and studying scores. This course prepares students for Music Theory and Ear Training 121/121L.",""
"98070","WGST-337-A","God and Gender","4","","W.Deifelt","2016/02/04 00:00:00","2016/05/19 00:00:00","A","Course can only fulfill either REL or HE general education requirement, not both.","02/04/2016-05/19/2016 Lecture Monday, Wednesday, Friday 01:30PM - 02:30PM, Main, Room 213","An investigation of how our understanding and experience of gender are connected to our views of God, human beings, and the natural world. The course explores the works of a variety of thinkers and pays special attention to issues raised by feminist theologians who stand both inside and outside the Christian tradition. Possible topics include: language about God, human sexuality, views of women in the Bible, the nature of biblical authority, the feminist movement, the men's movement, images of nature in Western religious thought, and the ordination of women. Offered alternate years. (Same as REL 233)","HE,INTCL,REL,RP,PBK"
"98082","WGST-342-A","Feminist Rhetorical Theories","4","","K.Powell","2016/02/04 00:00:00","2016/05/19 00:00:00","A","","02/04/2016-05/19/2016 Lecture Tuesday, Thursday 11:00AM - 12:30PM, Main, Room 116B","This course is a study of feminist rhetorical theories and expression. The class reads texts by feminist rhetorical theorists and rhetors. Special emphasis is placed on the intersection between social, cultural and economic contexts, political influences, and rhetorical strategies of women rhetors challenging Western patriarchy. This course counts as theory requirement for the WGST major. Offered alternate years. (Same as COMS 342)","HBSSM,SS,PBK,HIST,HE"
"97424","FREN-345-A","Conversation and Phonetics","4","","P.Russella","2016/02/04 00:00:00","2016/05/19 00:00:00","A","","02/04/2016-05/19/2016 Lecture Tuesday, Thursday 12:45PM - 02:15PM, Olin, Room 104","A course for advanced students wishing to increase their fluency through daily conversation on topics of current interest.  A systematic review of problems in French pronunciation is included. Offered on a rotating basis.","PBK"
"97857","PE-110-C01","Skill:Pilates","1","","D.Kohut","2016/03/29 00:00:00","2016/05/19 00:00:00","A","","03/29/2016-05/19/2016 PE Skills - 2nd 7 Weeks Monday, Wednesday, Friday 09:15AM - 10:15AM, Regents Center, Room DS","","SKL"
"97408","ENVS-215-A","Environmental Education","4","","E.Neal","2016/02/04 00:00:00","2016/05/19 00:00:00","A","Register for lecture and lab.","02/04/2016-05/19/2016 Lecture Tuesday, Thursday 12:45PM - 02:15PM, Valders, Room 379","An introduction to the theory and practice of environmental education while providing a foundation of basic environmental science content. Emphasis is placed on learning local and regional natural history as well as phenology and basic ecological processes. Students gain skills and learn methods necessary to effectively teach about the natural world. Focus is placed on planning and implementing environmental education programs, inquiry and interdisciplinary approaches, and place-based education. The course will include training for environmental curricula such as Project Wild and Project Wet.","NWL,NSL,PBK,ENVMJ"
"97930","POLS-132-A","Global Politics","4","","P.Gardner","2016/02/04 00:00:00","2016/05/19 00:00:00","A","","02/04/2016-05/19/2016 Lecture Tuesday, Thursday 08:00AM - 09:30AM, Koren, Room 218","This course will introduce students to (1) global issues, with examination of themes like globalization, economic development and poverty, global warming, ethnic conflict, democratization and war, and (2) global governance, with emphasis on the role of states, non-state actors and multilateral institutions.","INTCL,HBSSM,SS,GL,PBK"
"98153","POLS-132-B","Global Politics","4","","M.Engelhardt","2016/02/04 00:00:00","2016/05/19 00:00:00","A","","02/04/2016-05/19/2016 Lecture Monday, Wednesday, Friday 11:00AM - 12:00PM, Olin, Room 209","This course will introduce students to (1) global issues, with examination of themes like globalization, economic development and poverty, global warming, ethnic conflict, democratization and war, and (2) global governance, with emphasis on the role of states, non-state actors and multilateral institutions.","INTCL,HBSSM,SS,GL,PBK"
"97235","BIO-354L-A01","Evolutionary Biology Lab","0","","E.Baack","2016/02/04 00:00:00","2016/05/19 00:00:00","A","","02/04/2016-05/19/2016 Lab Thursday 02:15PM - 04:15PM, Sampson Hoffland Laboratories, Room 153","","PBK"
"98081","FREN-346-A","Intro to French Literature I","4","","A.Feat","2016/02/04 00:00:00","2016/05/19 00:00:00","A","","02/04/2016-05/19/2016 Lecture Tuesday, Thursday 02:30PM - 04:00PM, Main, Room 211","Historical survey of French literature from the earliest texts to the end of the 17th century. Emphasis on the development of literary forms, including the epic, drama, lyrical poetry and narrative literature. Fundamental concepts of analysis and criticism are presented. Attention will be paid to increasing the student's fluency in writing. Offered alternate years.","PBK,HEPT,ENGMJ"
"97360","EDUC-329-A","Science Methods","2","","B.Meade","2016/02/04 00:00:00","2016/05/19 00:00:00","A","Co-requisite Educ 328-A. ","02/04/2016-05/19/2016 Lecture Wednesday, Friday 01:30PM - 02:30PM, Valders, Room 379","This course is an introduction to the curriculum and pedagogy of a standards-based science program in the elementary school.  This course includes hands-on opportunities with the activities that support the inquiry of science as practiced in the elementary school classroom.",""
"98130","EDUC-329-B","Elementary Science Methods","2","","B.Meade","2016/02/04 00:00:00","2016/05/19 00:00:00","A","Corequisite: Educ-328B","02/04/2016-05/19/2016 Lecture Monday, Friday 01:30PM - 02:30PM, Valders, Room 379","This course is an introduction to the curriculum and pedagogy of a standards-based science program in the elementary school.  This course includes hands-on opportunities with the activities that support the inquiry of science as practiced in the elementary school classroom.",""
"97359","EDUC-328-A","Social Studies Methods","2","","D.Vesperman","2016/02/04 00:00:00","2016/05/19 00:00:00","A","Co-requisite: Educ 329-A.","02/04/2016-05/19/2016 Lecture Monday 01:30PM - 02:30PM, Koren, Room 216 (more)...","This course is an introduction to the curriculum and pedagogy for social studies instruction based on the National Council of Social Studies Standards.  Ten thematic strands frame the instructional planning for elementary and middle level curriculum.  Students will develop competencies in specific social studies related skills and become acquainted with current directions and research in elementary social studies including instructional technology.  This course is designed to assist pre-service teachers in developing appropriate tools for teaching social studies using an interdisciplinary approach.",""
"98128","EDUC-328-B","Elem Social Studies Methods","2","","D.Vesperman","2016/02/04 00:00:00","2016/05/19 00:00:00","A","Corequisite: Educ 329-B","02/04/2016-05/19/2016 Lecture Wednesday 01:30PM - 02:30PM, Koren, Room 216 (more)...","This course is an introduction to the curriculum and pedagogy for social studies instruction based on the National Council of Social Studies Standards.  Ten thematic strands frame the instructional planning for elementary and middle level curriculum.  Students will develop competencies in specific social studies related skills and become acquainted with current directions and research in elementary social studies including instructional technology.  This course is designed to assist pre-service teachers in developing appropriate tools for teaching social studies using an interdisciplinary approach.",""
"98074","WGST-490-A","Senior Project","1","4","C.Kunkel","2016/02/04 00:00:00","2016/05/19 00:00:00","A","","02/04/2016-05/19/2016 Independent Studies Days to be Announced, Times to be AnnouncedArranged, Room ARR","","PBK"
"97771","MUST-380-A","Internship","1","6","E.Tebbenhoff","2016/02/04 00:00:00","2016/05/19 00:00:00","A","","02/04/2016-05/19/2016 Internship Days to be Announced, Times to be AnnouncedArranged, Room ARR","Provides students with hands-on experience that stresses the kind of museum work relevant to their major disciplinary field including, but not limited to: research, exhibition, education, collections management, preservation, and administration.  The end-result being a tangible representation of their experience, whether it be a research document, portfolio, website, exhibit, or other product approved by their internship coordinator. This end product must be exclusively the student's own work.  The internship must be completed at a nationally or regionally recognized, reputable museum or cultural institution and is subject to the approval of the program director.  Students taking 2 credits must work a minimum of 75 hours and those taking 4 credits - a minimum of 150 hours in the semester.","JT2"
"97361","EDUC-331-A","Early Childhood Educ II","2","","J.Meyer-Mork","2016/02/04 00:00:00","2016/03/18 00:00:00","A","First seven weeks.","02/04/2016-03/18/2016 Lecture - First 7 Weeks Tuesday, Thursday 08:00AM - 09:30AM, Koren, Room 120","A review of the current research on curricular models, materials, and methodology in early childhood education. Particular attention given to research translation and implementation for working with infants and toddlers.",""
"98240","CHEM-474-A","Physical Inorganic Chemistry","2","","C.Mertzenich","2016/02/04 00:00:00","2016/03/18 00:00:00","A","First seven weeks.","02/04/2016-03/18/2016 Lecture - First 7 Weeks Tuesday, Thursday 08:00AM - 09:30AM, Valders, Room 367","An introduction to the use of symmetry for qualitative predictions of energy levels, molecular orbitals, and spectra of molecules. Offered alternate years.","PBK"
"98140","WGST-351-A","Gender and Crime","4","","J.Kremer","2016/02/04 00:00:00","2016/05/19 00:00:00","A","","02/04/2016-05/19/2016 Lecture Tuesday, Thursday 12:45PM - 02:15PM, Olin, Room 106","Examines how gender affects individuals' experiences as both victims and perpetrators of crime and deviance. Analyzes the history and theory of gender and crime in the U.S. and internationally, the social construction of victimization, and the impact of culture, structure, and inequality on criminal behavior. (Same as SOC 351)","HBSSM,PBK"
"98072","WGST-361-A","Chaucer & Medieval Literature","4","","K.Narveson","2016/02/04 00:00:00","2016/05/19 00:00:00","A","","02/04/2016-05/19/2016 Lecture Monday, Wednesday, Friday 11:00AM - 12:00PM, Main, Room 111","From heroes fighting monsters to Arthurian romances, medieval literature is best known for its stories of chivalry.  Less well-known but equally wonderful are the comic tales of sex in trees and greedy friars dividing a fart.  We will read Beowulf, narrative poems about love and adventure by Marie de France, the tale of Sir Gawain and the Green Knight, and much more, with in-depth attention to Chaucer's Canterbury Tales. Requires junior standing. (Same as ENG 361)","FA,PBK,HEPT"
"97866","PE-110-C01","Skill:Disc Golf","1","","A.Bailey","2016/03/29 00:00:00","2016/05/19 00:00:00","A","","03/29/2016-05/19/2016 PE Skills - 2nd 7 Weeks Monday, Wednesday, Friday 11:00AM - 12:00PM, Room to be Announced","","SKL"
"98079","WGST-243-A","Time of Stalin","4","","J.Conrad","2016/02/04 00:00:00","2016/05/19 00:00:00","A","Course is taught in English. Students who have completed Russian 202 may enroll in Russian 243 for additional coursework  in Russian.","02/04/2016-05/12/2016 Lecture Tuesday, Thursday 12:45PM - 02:15PM, Main, Room 212","This course, through the medium of literature and memoirs, focuses on Russia/Soviet Union in the early years after the Bolshevik Revolution (1917) until Gorbachev's glasnot and perestroika. Students will learn about the rise of Stalin, the time of terror and purges at the height of Stalin's regime (mid 1930s), WWII, the ""Thaw"" after Stalin's death in 1953, and the implications Stalinism has on present-day Russia.  We will seek answers to the questions of how Stalin was allowed to rise to power, retain political control, and instigate policies that caused the deaths of approximately 20 million Soviet citizens - many of whom were Bolsheviks and loyal members of the Communist Party.  Literary readings include memoirs, poetry, and novels.  A significant part of the course concerns the role of women in the Bolshevik Revolution and their fate under Stalinism. This course fulfills requirements of international studies, women and gender studies, and Russian studies. This course is taught in English and readings are in English. Offered alternate years.(Same as FCUL 243.)","INTCL,HIST,HEPT,PBK,GL"
"98150","PHIL-310-A","Metaphysics & Epistemology","4","","G.Jesson","2016/02/04 00:00:00","2016/05/19 00:00:00","A","","02/04/2016-05/19/2016 Lecture Tuesday, Thursday 02:30PM - 04:00PM, Loyalty Hall, Room 010","A comparative and critical study of major theories about being and knowing.  Metaphysical issues focus on the nature of reality, including the relationship between mind and matter, substance and attribute, time, space, causation, change, modality, and identity.  Epistemological topics concern the possibility, origins, nature, and extent of human knowledge.  The course includes classical as well as contemporary readings, covering a wide range of philosophical theories and their interaction.","RP,HEPT,PBK"
"97277","CHEM-301-A","Biochemistry I","4","","J.Jefferson","2016/02/04 00:00:00","2016/05/19 00:00:00","A","","02/04/2016-05/19/2016 Lecture Monday, Wednesday, Friday 01:30PM - 02:30PM, Valders, Room 362","An introduction to the chemistry of the four major classes of biological molecules:proteins, sugars, lipids, and nucleic acids.  The relationship between the functional roles of these molecules and their structure and reactivity will be examined using the chemical principles mastered in the prerequisite courses of general chemistry and two semesters of organic chemistry.  This course will fulfill the one-semester biochemistry prerequisite of typical health professional programs.",""
"97428","FREN-490-A","Senior Project","1","4","A.Feat","2016/02/04 00:00:00","2016/05/19 00:00:00","A","","02/04/2016-05/19/2016 Independent Studies Days to be Announced, Times to be AnnouncedArranged, Room ARR","The senior project requirement gives students an opportunity to participate in independent study, to read relevant literature in their chosen area, to develop methods of research and analysis appropriate to their selected topic, and to construct a sustained argument in the language of their major. To enrich their work, students will be encouraged to reflect on and use their study-abroad and firsthand cultural experiences as a means of contextualizing their projects. The research pape is written in French and is presented orally as well. If students have another major in addition to French, they are not required to complete a senior project in both majors. ","PBK"
